{
    "Xmin": -10.0,
    "Xmax": 10.0,
    "Xscl": 1.0,
    "Ymin": -10.0,
    "Ymax": 10.0,
    "Yscl": 1.0,
    "Thetamin": 0.0,
    "Thetamax": "6.283185307",
    "Thetastep": "0.13089969389957",
    "Tmin": 0.0,
    "Tmax": "6.283185307",
    "Tstep": "0.13089969389957",
    "PlotStart": 1,
    "nMax": 10,
    "unMin0": 1.0,
    "vnMin0": 1.0,
    "nMin": 1,
    "unMin1": 1.0,
    "vnMin1": 1.0,
    "wnMin0": 1.0,
    "PlotStep": 1,
    "Xres": 1,
    "wnMin1": 1.0
}